"Name","Source","Rarity","Type","Attunement","Properties","Weight","Value","Text"
"Sled Dog","IDRotF","none","mount","","","","50 gp","A sled dog (use the wolf stat block in appendix A of the Monster Manual) costs 50 gp and can pull 360 pounds.Sled dogs must take a short rest after pulling a sled for 1 hour; otherwise, they gain one level of exhaustion."
"Sledgehammer","PHB","none","adventuring gear","","","10 lb.","2 gp",""
"Sling","PHB","none","simple weapon, ranged weapon","","1d4, bludgeoning, - ammunition (30/120 ft.)","","1 sp","Ammunition. You can use a weapon that has the ammunition property to make a ranged attack only if you have ammunition to fire from the weapon. Each time you attack with the weapon, you expend one piece of ammunition. Drawing the ammunition from a quiver, case, or other container is part of the attack. Loading a one-handed weapon requires a free hand. At the end of the battle, you can recover half your expended ammunition by taking a minute to search the battlefield.If you use a weapon that has the ammunition property to make a melee attack, you treat the weapon as an improvised weapon. A sling must be loaded to deal any damage when used in this way."
"Sling Bullet","PHB","none","ammunition","","","1.2 oz.","0.2 cp",""
"Sling Bullets (20)","PHB","none","ammunition","","","1½ lb.","4 cp",""
"Small gold bracelet","DMG","none","treasure","","","","25 gp",""
"Small gold idol","DMG","none","treasure","","","","750 gp",""
"Small gold statuette set with rubies","DMG","none","treasure","","","","7,500 gp",""
"Small mirror set in a painted wooden frame","DMG","none","treasure","","","","25 gp",""
"Smith's Tools","PHB","none","artisan's tools","","","8 lb.","20 gp","Smith's tools allow you to work metal, heating it to alter its shape, repair damage, or work raw ingots into useful items. Components. Smith's tools include hammers, tongs, charcoal, rags, and a whetstone. Arcana and History. Your expertise lends you additional insight when examining metal objects, such as weapons. Investigation. You can spot clues and make deductions that others might overlook when an investigation involves armor, weapons, or other metalwork. Repair. With access to your tools and an open flame hot enough to make metal pliable, you can restore 10 hit points to a damaged metal object for each hour of work.Smith's ToolsActivityDCSharpen a dull blade10Repair a suit of armor15Sunder a nonmagical metal object15See the Tool Proficiencies entry for more information."
"Smoke Grenade","DMG","none","modern, explosive","","","2 lb.","","As an action, a character can throw a grenade at a point up to 60 feet away. With a grenade launcher, the character can propel the grenade up to 120 feet away.One round after a smoke grenade, lands, it emits a cloud of smoke that creates a heavily obscured area in a 20-foot radius. A moderate wind (at least 10 miles per hour) disperses the smoke in 4 rounds; a strong wind (20 or more miles per hour) disperses it in 1 round."
"Snowshoes","IDRotF","none","adventuring gear","","","4 lb.","2 gp","Snowshoes reduce the likelihood of their wearer getting stuck in the deep snow."
"Soap","PHB","none","adventuring gear","","","","2 cp",""
"Songhorn","SCAG","none","instrument","","","","","A recorder, a simple type of flute, usually carved from wood.See the Tool Proficiencies entry for more information.Proficiency with a musical instrument indicates you are familiar with the techniques used to play it. You also have knowledge of some songs commonly performed with that instrument. History. Your expertise aids you in recalling lore related to your instrument. Performance. Your ability to put on a good show is improved when you incorporate an instrument into your act. Compose a Tune. As part of a long rest, you can compose a new tune and lyrics for your instrument. You might use this ability to impress a noble or spread scandalous rumors with a catchy tune.Musical InstrumentActivityDCIdentify a tune10Improvise a tune20"
"Soothsalts","EGW","none","potion","","","","150 gp","Soothsalts are derived from a naturally occurring crystalline substance discovered throughout the wilds of the Miskath Strand. The crimson crystals have been mined from cavernous veins like those in the mouth of the Miskath Pit and found within smaller geode formations near sites ravaged by the Calamity. Soothsalts are consumed orally in lozenge-sized doses, and frequent users can be identified by the telltale crimson stain around their mouths. A creature subjected to a dose of soothsalts gains advantage on all Intelligence checks for 1d4 hours.For each dose of soothsalts consumed, the creature must succeed on a DC 15 Constitution saving throw or gain one level of exhaustion—an effect which is cumulative with multiple doses."
"Spear","PHB","none","simple weapon, melee weapon","","1d6, piercing, - thrown (20/60 ft.), versatile (1d8)","3 lb.","1 gp","Thrown. If a weapon has the thrown property, you can throw the weapon to make a ranged attack. If the weapon is a melee weapon, you use the same ability modifier for that attack roll and damage roll that you would use for a melee attack with the weapon. For example, if you throw a handaxe, you use your Strength, but if you throw a dagger, you can use either your Strength or your Dexterity, since the dagger has the finesse property. Versatile. This weapon can be used with one or two hands. A damage value in parentheses appears with the property—the damage when the weapon is used with two hands to make a melee attack."
"Spellbook","PHB","none","adventuring gear","","","3 lb.","50 gp","Essential for wizards, a spellbook is a leather-bound tome with 100 blank vellum pages suitable for recording spells."
"Spiked Armor","SCAG","unknown","medium armor","","AC 14 + Dex (max 2)","45 lb.","75 gp","Spiked armor is a rare type of medium armor made by dwarves. It consists of a leather coat and leggings covered with spikes that are usually made of metal.The wearer has disadvantage on Dexterity (Stealth) checks."
"Spinel","DMG","none","treasure","","","","100 gp","A transparent red, red-brown, or deep green gemstone."
"Splint Armor","PHB","none","heavy armor","","AC 17","60 lb.","200 gp","This armor is made of narrow vertical strips of metal riveted to a backing of leather that is worn over cloth padding. Flexible chain mail protects the joints.The wearer has disadvantage on Dexterity (Stealth) checks.If the wearer has a Strength score lower than 15, their speed is reduced by 10 feet."
"Sprig of Mistletoe","PHB","none","spellcasting focus","","","","1 gp","A druid can use this object as a spellcasting focus."
"Spyglass","PHB","none","adventuring gear","","","1 lb.","1,000 gp","Objects viewed through a spyglass are magnified to twice their size."
"Stabling (per day)","PHB","none","tack and harness","","","","5 sp",""
"Staff","PHB","none","staff, melee weapon, spellcasting focus","","","4 lb.","5 gp","An arcane focus is a special item designed to channel the power of arcane spells. A sorcerer, warlock, or wizard can use such an item as a spellcasting focus."
"Star Ruby","DMG","none","treasure","","","","1,000 gp","A translucent ruby with white star-shaped center gemstone."
"Star Sapphire","DMG","none","treasure","","","","1,000 gp","A translucent blue sapphire with white star-shaped center gemstone."
"Star rose quartz","DMG","none","treasure","","","","50 gp","A translucent rosy stone with white star-shaped center gemstone."
"Steel Mirror","PHB","none","adventuring gear","","","½ lb.","5 gp",""
"Studded Leather Armor","PHB","none","light armor","","AC 12 + Dex","13 lb.","45 gp","Made from tough but flexible leather, studded leather is reinforced with close-set rivets or spikes."
"Sun","WDH","none","treasure","","","","10 gp","Platinum coin, twice as large as a nib (1 sun = 1,000 nibs)"
"Survival Mantle","VGM","unknown","medium armor","","AC 15 + Dex (max 2)","40 lb.","","This carapace-like augmentation encases portions of the wearer's shoulders, neck, and chest. A survival mantle is equivalent to a suit of nonmagical half plate armor and takes just as long to don or doff. It can't be worn with other kinds of armor.A creature wearing a survival mantle can breathe normally in any environment (including a vacuum) and has advantage on saving throws against harmful gases (such as those created by a cloudkill spell, a stinking cloud spell, inhaled poisons, and the breath weapons of some dragons).The wearer has disadvantage on Dexterity (Stealth) checks."
"Tangler Grenade","WDMM","none","other","","","","","A tangler grenade is an alchemical, nonmagical item with an ovoid resin shell that shatters on impact. An as action, a creature can throw a tangler grenade at a point up to 60 feet away. Each creature within 10 feet of a shattered tangler grenade must succeed on a DC 15 Dexterity saving throw or be restrained by sticky white webs. As an action, a creature can try to free itself or another creature within its reach from the webs, doing so with a successful DC 20 Strength (Athletics) check. A gallon of alcohol dissolves the webs produced by a single tangler grenade. Otherwise, the webs dissolve on their own after 1 hour, freeing any creatures restrained by them."
"Tankard","PHB","none","adventuring gear","","","1 lb.","2 cp","A tankard holds 1 pint of liquid."
"Tantan","SCAG","none","instrument","","","","","A tambourine, a popular instrument with halflings and humans south of the Dalelands.See the Tool Proficiencies entry for more information.Proficiency with a musical instrument indicates you are familiar with the techniques used to play it. You also have knowledge of some songs commonly performed with that instrument. History. Your expertise aids you in recalling lore related to your instrument. Performance. Your ability to put on a good show is improved when you incorporate an instrument into your act. Compose a Tune. As part of a long rest, you can compose a new tune and lyrics for your instrument. You might use this ability to impress a noble or spread scandalous rumors with a catchy tune.Musical InstrumentActivityDCIdentify a tune10Improvise a tune20"
"Taol","WDH","none","treasure","","","","2 gp","Brass coin, about two inches square with a hold large enough for a nib to fit in (1 taol = 200 nibs)"
"Tej","ToA","none","food and drink","","","5 lb.","","Tej is an amber-colored, fermented drink made from honey. It's more common and popular in Chult than beer or ale. A mug of tej costs 4 cp in Port Nyanzaru or 6 cp in Fort Beluarian. A 1-gallon cask costs 2 sp in the city or 3 sp at the fort."
"Teleporter Ring","WDH","unknown","ring","","","","","As an action, a creature wearing a teleporter ring can activate the teleportation circle either in area K22 or area E1, teleporting itself and up to six other willing creatures from one circle to the other."
"The Incantations of Iriolarthas","IDRotF","unknown","adventuring gear","","","3 lb.","","The Incantations of Iriolarthas is a weighty spellbook. Its black leather covers have dead, toothy worms glued to them, sheathed in glossy varnish. Set into this morbid display on the front cover is a gold rune that resembles a stylized eye with a pupil shaped like a candle flame—the sigil of Iriolarthas, a Netherese lich.The book contains sixty pages of brittle yellow vellum. Written on these pages are the following wizard spells:1st level: alarm, detect magic, identify, magic missile, shield, Tasha's hideous laughter, thunderwave2nd level: arcane lock, continual flame, invisibility, knock, levitate, Melf's acid arrow, mirror image3rd level: animate dead, bestow curse, clairvoyance, counterspell, dispel magic, fireball, glyph of warding4th level: arcane eye, banishment, blight, dimension door, Evard's black tentacles, phantasmal killer5th level: Bigby's hand, cloudkill, dominate person, planar binding, scrying, telekinesis6th level: create undead, disintegrate, globe of invulnerability, move earth, Otto's irresistible dance7th level: create magen, finger of death, prismatic spray, teleport8th level: demiplane, dominate monster, mind blank, power word stun9th level: blade of disaster, power word kill"
"Theki Root","EGW","none","potion","","","","3 gp","This thick marsh root tastes bitter but is thought to aid digestive health. When you use an action to consume a dose, you gain advantage on saving throws against the effects of poisonous or toxic substances for 8 hours."
"Thelarr","SCAG","none","instrument","","","","","Also known as a whistlecane, a simple and easy-to-make wind instrument cut from a reed. They are so simple, in fact, that skilled bards frequently make and give them away to children—to the parents' delight or regret.See the Tool Proficiencies entry for more information.Proficiency with a musical instrument indicates you are familiar with the techniques used to play it. You also have knowledge of some songs commonly performed with that instrument. History. Your expertise aids you in recalling lore related to your instrument. Performance. Your ability to put on a good show is improved when you incorporate an instrument into your act. Compose a Tune. As part of a long rest, you can compose a new tune and lyrics for your instrument. You might use this ability to impress a noble or spread scandalous rumors with a catchy tune.Musical InstrumentActivityDCIdentify a tune10Improvise a tune20"
"Thieves' Tools","PHB","none","tools","","","1 lb.","25 gp","This set of tools includes a small file, a set of lock picks, a small mirror mounted on a metal handle, a set of narrow-bladed scissors, and a pair of pliers. Proficiency with these tools lets you add your proficiency bonus to any ability checks you make to disarm traps or open locks.Perhaps the most common tools used by adventurers, thieves' tools are designed for picking locks and foiling traps. Proficiency with the tools also grants you a general knowledge of traps and locks. Components. Thieves' tools include a small file, a set of lock picks, a small mirror mounted on a metal handle, a set of narrow-bladed scissors, and a pair of pliers. History. Your knowledge of traps grants you insight when answering questions about locations that are renowned for their traps. Investigation and Perception. You gain additional insight when looking for traps, because you have learned a variety of common signs that betray their presence. Set a Trap. Just as you can disable traps, you can also set them. As part of a short rest, you can create a trap using items you have on hand. The total of your check becomes the DC for someone else's attempt to discover or disable the trap. The trap deals damage appropriate to the materials used in crafting it (such as poison or a weapon) or damage equal to half the total of your check, whichever the DM deems appropriate.Thieves' ToolsActivityDCPick a lockVariesDisable a trapVariesSee the Tool Proficiencies entry for more information."
"Three-Dragon Ante Set","PHB","none","gaming set","","","","1 gp","See the Tool Proficiencies entry for more information.Proficiency with a gaming set applies to one type of game, such as Three-Dragon Ante or games of chance that use dice. Components. A gaming set has all the pieces needed to play a specific game or type of game, such as a complete deck of cards or a board and tokens. History. Your mastery of a game includes knowledge of its history, as well as of important events it was connected to or prominent historical figures involved with it. Insight. Playing games with someone is a good way to gain understanding of their personality, granting you a better ability to discern their lies from their truths and read their mood. Sleight of Hand. Sleight of Hand is a useful skill for cheating at a game, as it allows you to swap pieces, palm cards, or alter a die roll. Alternatively, engrossing a target in a game by manipulating the components with dexterous movements is a great distraction for a pickpocketing attempt.Gaming SetActivityDCCatch a player cheating15Gain insight into an opponent's personality15"
"Tiger Eye","DMG","none","treasure","","","","10 gp","A translucent brown with golden center gemstone."
"Tinderbox","PHB","none","adventuring gear","","","1 lb.","5 sp","This small container holds flint, fire steel, and tinder (usually dry cloth soaked in light oil) used to kindle a fire. Using it to light a torch—or anything else with abundant, exposed fuel—takes an action. Lighting any other fire takes 1 minute."
"Tinker's Tools","PHB","none","artisan's tools","","","10 lb.","50 gp","A set of tinker's tools is designed to enable you to repair many mundane objects. Though you can't manufacture much with tinker's tools, you can mend torn clothes, sharpen a worn sword, and patch a tattered suit of chain mail. Components. Tinker's tools include a variety of hand tools, thread, needles, a whetstone, scraps of cloth and leather, and a small pot of glue. History. You can determine the age and origin of objects, even if you have only a few pieces remaining from the original. Investigation. When you inspect a damaged object, you gain knowledge of how it was damaged and how long ago. Repair. You can restore 10 hit points to a damaged object for each hour of work. For any object, you need access to the raw materials required to repair it. For metal objects, you need access to an open flame hot enough to make the metal pliable.Tinker's ToolsActivityDCTemporarily repair a disabled device10Repair an item in half the time15Improvise a temporary item using scraps20See the Tool Proficiencies entry for more information."
"Tocken","SCAG","none","instrument","","","","","A hanging set of carved oval bells, usually played with a pair of light wooden hammers (or open handed). They are most common in underground cultures, where the resonant tones can carry.See the Tool Proficiencies entry for more information.Proficiency with a musical instrument indicates you are familiar with the techniques used to play it. You also have knowledge of some songs commonly performed with that instrument. History. Your expertise aids you in recalling lore related to your instrument. Performance. Your ability to put on a good show is improved when you incorporate an instrument into your act. Compose a Tune. As part of a long rest, you can compose a new tune and lyrics for your instrument. You might use this ability to impress a noble or spread scandalous rumors with a catchy tune.Musical InstrumentActivityDCIdentify a tune10Improvise a tune20"
"Tome of Strahd","CoS","none","adventuring gear","","","5 lb.","","The Tome of Strahd is an ancient work penned by Strahd, a tragic tale of how he came to his fallen state. The book is bound in a thick leather cover with steel hinges and fastenings. The pages are of parchment and very brittle. Most of the book is written in the curious shorthand that only Strahd employs. Stains and age have made most of the work illegible, but several paragraphs remain intact."
"Topaz","DMG","none","treasure","","","","500 gp","A transparent golden yellow gemstone."
"Torch","PHB","none","adventuring gear","","","1 lb.","1 cp","A torch burns for 1 hour, providing bright light in a 20-foot radius and dim light for an additional 20 feet. If you make a melee attack with a burning torch and hit, it deals 1 fire damage."
"Torpor","DMG","none","adventuring gear, poison (ingested)","","","","600 gp","A creature subjected to this poison must succeed on a DC 15 Constitution saving throw or become poisoned for 4d6 hours. The poisoned creature is incapacitated."
"Totem","PHB","none","spellcasting focus","","","","1 gp","A druid can use this object as a spellcasting focus."
"Tourmaline","DMG","none","treasure","","","","100 gp","A transparent pale green, blue, brown, or red gemstone."
"Traveler's Clothes","PHB","none","adventuring gear","","","4 lb.","2 gp",""
"Trident","PHB","none","martial weapon, melee weapon","","1d6, piercing, - thrown (20/60 ft.), versatile (1d8)","4 lb.","5 gp","Thrown. If a weapon has the thrown property, you can throw the weapon to make a ranged attack. If the weapon is a melee weapon, you use the same ability modifier for that attack roll and damage roll that you would use for a melee attack with the weapon. For example, if you throw a handaxe, you use your Strength, but if you throw a dagger, you can use either your Strength or your Dexterity, since the dagger has the finesse property. Versatile. This weapon can be used with one or two hands. A damage value in parentheses appears with the property—the damage when the weapon is used with two hands to make a melee attack."
"Trinket","AI","none","adventuring gear","","","","","Worried that you're going to pull out your dead sprite inside a clear glass bottle at a company function only to discover that three other people in the franchise have one as well? Then consider rolling on the Acquisitions Incorporated Trinkets table instead of the table in chapter 5 of the Player's Handbook, to gain a unique trinket at character creation with a bit of Acq Inc flair.Acquisitions Incorporated Trinketsd100Trinket1A perfect skipping stone2Three weighted dice that always roll low3A locket with a picture of Jim Darkmagic4A tiny anvil and smith's hammer5A nonfunctional immovable rod6A DIY acupuncture kit7A stuffed owlbear toy8A diagram for a new war lute9A declaration of war against a nation no one has ever heard of10A pipe that emits green smoke11A glass eye12The centerpiece of a priceless chandelier13A fine cane with a secret compartment14A letter written by Rosie Beestinger15A coin that always lands on its edge16The deed and title to an abandoned windmill and three acres of tillable land that you've never been able to find17A menu from Big Daddy Donaar's Yum Yum Hut18A small purse that screams loudly when opened19A deep-crow-feather quill20A pair of breeches that always smells faintly of honey21A one-armed Viari doll (Apocalypse Dagger accessory missing)22A leather pouch filled with various finger bones of unknown provenance23The collar of your childhood pet, Nutmeg24A seashell that, when pressed to the ear, speaks in flowing rhymes25A recipe book for cooking with mushrooms26One expired coupon for ""A Free Cornerstone""27A portable beehive28Goggles that literally tint everything rose colored29A wand of wonder that allows you to cast only mending30A bracelet woven from mistletoe31A curved claw from an unknown beast that small children are always frightened of32A longsword that can be folded down in 1 minute and hidden in your pocket33A living graft of what you believe to be the World Tree34A tattered scarf with the Acquisitions Incorporated logo35A box containing a torn-up letter36An old contract marked ""Void""37A small pigeon in a cage38An Acquisitions Incorporated ""Green Flame"" foam finger39A ""C"" Team lunchbox40A potted plant that grows different fruit on every branch41A book of adventures for children42An Omin action figure with detachable maul and holy symbol43A pint glass engraved with a picture of a keg robot44A giant hockey puck45A miniature cannon that actually fires46A very fancy red scarf and matching handkerchief47An arrow once shot by Môrgæn48A purple worm toy49A burned doll whose eyes follow you around the room50An infinite inkwell51A band embroidered with the symbol of the Six52A squishy cactus53A velvet blindfold54A dirty figurine of a triceratops that can't be cleaned55A used (and thus nonmagical) noble knife from the Noble Knife56A quill that rotates through all the colors of the rainbow57A twenty-sided die that only rolls the number 458A pointed hat that glows in the dark59A cup that hums when filled with water60A mug fashioned from the skull of someone else's enemy61A small glass jar containing an immortal firefly62A fake mustache made from gnome facial hair63A petrified troll finger64Half of a map65The other half of a map66An unreasonable amount of pocket lint67A dozen flyers for a local gnome food place68Omin Dran's business card69A lock of hair from a changeling70A marble that rolls uphill71A piece of parchment listing a command word for a powerful magic item72A book titled Conversational Giant73A user's manual for an apparatus of Kwalish74A signed headshot of famous bard Spice Caraway75The eye of a basilisk in a crystal box76A postcard from Ravnica77A stamp collection78A small piece of solidified smoke79A six-sided die that sometimes rolls a seven80A left-hand gauntlet81A music box that plays nursery rhymes82A locket that's bigger on the outside than the inside83A potted plant that grows hair instead of leaves84A collection of teeth85A coin whose minting date always shows three years in the future86A green drinking horn taken from a very large bull87A small book containing pressed and dried botanical samples88A hatched chimera egg89A slightly used red bandit mask90A tiny stirge encased in amber91A large bottle of Red Larch Ale that can't be opened92A cane topped with a stylized golden bulldog93A note in your own hand that you don't remember writing94A sprig of herbs from your family's garden95A tankard stolen from the Dran & Courtier96A small, severed tentacle preserved in alcohol97A walnut with a face drawn on it98A small flask of liquid from the Lake of Radiant Mists99An ice cube that never melts00An expertly carved sword hilt with the blade snapped cleanly off"
